<?xml version="1.0" encoding="UTF-8"?>
<!DOCTYPE employees SYSTEM "employees.dtd">
<employees>
    <employee id="111">
        <firstname>Allen</firstname>
        <lastname>Smith</lastname>
        <location>Alaska</location>
    </employee>
    
    <employee id="112">
        <firstname>John</firstname>
        <lastname>Davis</lastname>
        <location>California</location>
    </employee>
    
    <employee id="113">
        <firstname>Bob</firstname>
        <lastname>Marley</lastname>
        <location>Jamaica</location>
    </employee>
    
    <employee id="114">
        <firstname>Anna</firstname>
        <lastname>Jackson</lastname>
        <location>Seychelles</location>
    </employee>
        
    <employee id="115">
        <firstname>Michelle</firstname>
        <lastname>Sawyer</lastname>
        <location>Kansas</location>
    </employee>
    
</employees>



